{
  "$schema": "./schema.json",
  "Signing Algorithm": "Schnorr",
  "Implementation Support (e.g. Libraries) / Active Community": "many mature implementations",
  "IPR Policy": "patents expired",
  "Specification": "different curves-different specs",
  "Standardization (Body, Process)": "different curves-different standards",
  "Technology Readiness Level": "TRL 9",
  "Recognition by government authorities (NIST, BSI, ...)": "NIST with Curve25519",
  "Performance": "high",
  "Hardware support": false,
  "Unlinkability/Uncorrelatability/Blind signatures possible": false,
  "Security strength": "tbd",
  "Post-quantum security": false
}
