{
  "$schema": "./schema.json",
  "Signing Algorithm": "ECDSA",
  "Implementation Support (e.g. Libraries) / Active Community": "many mature implementations",
  "IPR Policy": "tbd",
  "Specification": "X9.62-2005",
  "Standardization (Body, Process)": "ANSI",
  "Technology Readiness Level": "TRL 9",
  "Recognition by government authorities (NIST, BSI, ...)": true,
  "Performance": "tbd",
  "Hardware support": true,
  "Unlinkability/Uncorrelatability/Blind signatures possible": false,
  "Security strength": "256 / 384 / 512 bit",
  "Post-quantum security": false
}
