{
  "$schema": "./schema.json",
  "Signing Algorithm": "BoundBBS+",
  "IPR Policy": "barely",
  "Standardization (Body, Process)": "DIF (intention to transfer to IRTF CFRG)",
  "Recognition by government authorities (NIST, BSI, ...)": "not acknowledged",
  "Hardware support": false,
  "Unlinkability/Uncorrelatability/Blind signatures possible": true,
  "Post-quantum security": false
}
